LINK,AI/NOT AI,input_url_full,url,url_query_is_from_webapp,url_query_web_id,status,raw_source_used,video_id,author,create_time,description,play_count,like_count,comment_count,share_count,is_aigc,ai_keys_strict,ai_keys_broad,ai_pairs_strict_json,ai_pairs_broad_json,ai_value_hits_json,dom_has_ai_text,dom_matched_needle,dom_ai_snippet,html_dump_path,manual_ai,tiktok_labeled_aigc
https://www.tiktok.com/@leafchunch30days/video/7577580934644501815?is_from_webapp=1&sender_device=pc,NOT AI,https://www.tiktok.com/@leafchunch30days/video/7577580934644501815?is_from_webapp=1&sender_device=pc,https://www.tiktok.com/@leafchunch30days/video/7577580934644501815,1.0,,ok,__UNIVERSAL_DATA_FOR_REHYDRATION__,7.577580934644502e+18,leafchunch30days,1764293073.0,Another good find for today’s leaf || follow for tomorrows leaf crunch || #fyp #leafcrunch #day8 #viral ,119300000.0,14900000.0,54300.0,1200000.0,False,__DEFAULT_SCOPE__.webapp.video-detail.itemInfo.itemStruct.IsAigc,__DEFAULT_SCOPE__.webapp.biz-context.config.onDeviceMLConfig.commentsPreload.commentPreloadHighThreshold.preload_ml.output[0].labels;__DEFAULT_SCOPE__.webapp.biz-context.config.onDeviceMLConfig.commentsPreload.commentPreloadLowThreshold.preload_ml.output[0].labels;__DEFAULT_SCOPE__.webapp.biz-context.config.onDeviceMLConfig.playerPreload.playerPreloadStrategy.preload_ml.output[0].labels;__DEFAULT_SCOPE__.webapp.video-detail.itemInfo.itemStruct.IsAigc,"[{""path"": ""__DEFAULT_SCOPE__.webapp.video-detail.itemInfo.itemStruct.IsAigc"", ""value"": false}]","[{""path"": ""__DEFAULT_SCOPE__.webapp.biz-context.config.onDeviceMLConfig.commentsPreload.commentPreloadHighThreshold.preload_ml.output[0].labels"", ""value"": [""true"", ""false""]}, {""path"": ""__DEFAULT_SCOPE__.webapp.biz-context.config.onDeviceMLConfig.commentsPreload.commentPreloadLowThreshold.preload_ml.output[0].labels"", ""value"": [""true"", ""false""]}, {""path"": ""__DEFAULT_SCOPE__.webapp.biz-context.config.onDeviceMLConfig.playerPreload.playerPreloadStrategy.preload_ml.output[0].labels"", ""value"": [""true"", ""false""]}, {""path"": ""__DEFAULT_SCOPE__.webapp.video-detail.itemInfo.itemStruct.IsAigc"", ""value"": false}]","[{""path"": ""__DEFAULT_SCOPE__.webapp.i18n-translation.Webapp.seo_downloader_AboutDownloadingTikTokVideos"", ""value"": ""About downloading TikTok videos without watermark""}, {""path"": ""__DEFAULT_SCOPE__.webapp.i18n-translation.Webapp.seo_downloader_legal1"", ""value"": ""To protect creators' rights, TikTok currently does not support the download of videos without watermarks.""}, {""path"": ""__DEFAULT_SCOPE__.webapp.i18n-translation.Webapp.seo_downloader_metaDesc"", ""value"": ""Download TikTok videos effortlessly. Use TikTok Downloader and download TikTok videos without watermarks, as well as save them in MP3 and MP4 formats.""}, {""path"": ""__DEFAULT_SCOPE__.webapp.i18n-translation.Webapp.seo_downloader_mainMetaKeywords"", ""value"": ""Download Video TikTok, TikTok video Download, TikTok MP3, TikTok MP4, TikTok watermark, Save TikTok videos, Save TikTok""}, {""path"": ""__DEFAULT_SCOPE__.webapp.i18n-translation.Webapp.ad_report_reason_L1Misinfo_L2aigc_v2_0"", ""value"": ""This ad may contain AI-generated or edited content that is misused, unauthorized, or mislabeled. This can include:""}, {""path"": ""__DEFAULT_SCOPE__.webapp.i18n-translation.Webapp.ad_report_reason_L1Misinfo_L2aigc_v2_1"", ""value"": ""AI-generated content that isn't labeled or disclosed. The ad uses AI to create content, but doesn't say so.""}, {""path"": ""__DEFAULT_SCOPE__.webapp.i18n-translation.Webapp.seo_popular_disclaimer"", ""value"": ""This is an AI-generated summary of the content, and is not intended to provide factual context. If you think it may contain an error, please report at:""}, {""path"": ""__DEFAULT_SCOPE__.webapp.i18n-translation.Webapp.vid_mod_analytics_penalty_reason_unoriginal_desc"", ""value"": ""To keep TikTok positive and enjoyable for our users, content that is unoriginal or low quality is ineligible for recommendation. Unoriginal content includes videos that are just imported or uploaded from other sources (like other platforms, TV shows, movies, or webcasts) without any new, creative edits. We can tell if a video is unoriginal if it has a watermark or a superimposed logo on it. Low quality content includes very short videos, static images, and videos made only of GIFs. Content that includes QR codes is usually ineligible for the For You feed because it can lead users to harmful websites or apps, even though we make exceptions in circumstances where the risk is low (for example, for e-commerce).""}, {""path"": ""__DEFAULT_SCOPE__.webapp.i18n-translation.Webapp.vid_mod_analytics_nr_vid_penalty_reason_unoriginal_desc"", ""value"": ""To maintain the positive experience our users expect from the TikTok platform, unoriginal and low-quality content is ineligible for recommendation. Unoriginal content is content that is just imported or copied from other sources without any new, creative edits. A video may be unoriginal if it has a watermark or logo on it. Low quality content includes very short videos, static images, and videos made only of GIFs.""}, {""path"": ""__DEFAULT_SCOPE__.webapp.i18n-translation.Webapp.syntheticMedia_feed_bottomBanner_AIGCLabel"", ""value"": ""Creator labeled as AI-generated""}, {""path"": ""__DEFAULT_SCOPE__.webapp.i18n-translation.Webapp.aigcInfoPanel_feed_label"", ""value"": ""Contains AI-generated media""}]",True,ai-generated," leaf and enjoy satisfying sounds! #leafcrunch #day8</div><div class=""css-1n84gel-7937d88b--DivDisclaimerContainer e1u8ltso0""><svg class=""css-ryvs3t-7937d88b--StyledIcon e1u8ltso3"" width=""1em"" data-e2e="""" height=""1em"" viewBox=""0 0 48 48"" fill=""currentColor"" xmlns=""http://www.w3.org/2000/svg""><path fill-rule=""evenodd"" clip-rule=""evenodd"" d=""M24 6C14.0589 6 6 14.0589 6 24C6 33.9411 14.0589 42 24 42C33.9411 42 42 33.9411 42 24C42 14.0589 33.9411 6 24 6ZM2 24C2 11.8497 11.8497 2 24 2C36.1503 2 46 11.8497 46 24C46 36.1503 36.1503 46 24 46C11.8497 46 2 36.1503 2 24ZM27 32C27 33.6569 25.6569 35 24 35C22.3431 35 21 33.6569 21 32C21 30.3431 22.3431 29 24 29C25.6569 29 27 30.3431 27 32ZM23 13C22.4477 13 22 13.4477 22 14V25C22 25.5523 22.4477 26 23 26H25C25.5523 26 26 25.5523 26 25V14C26 13.4477 25.5523 13 25 13H23Z""></path></svg><div class=""css-nrne3l-7937d88b--DivDisclaimer e1u8ltso1"">This is an AI-generated summary of the content, and is not intended to provide factual context. If you think it may contain an error, please report at: <a class=""css-4niwmx-7937d88b--StyledLink e1u8ltso2"" href=""/feedback"">Feedback and help - TikTok</a></div></div></div></div><button type=""button"" height=""18"" class=""css-1j5hai-7937d88b--ButtonExpand-7937d88b--StyledButtonBottom e1fmr01i3"">more</button></div></div></div><div class=""css-1uv1il1-7937d88b--DivOverlayBottomCornerControls e1ny156f4""></div></div></div><div class=""css-9p2al5-7937d88b--DivVideoProgressContainer eer0cdn0""><p class=""TUXText TUXText--tiktok-display TUXText--weight-bold e10i2kxg0 css-7hennm-7937d88b--StyledTUXText-7937d88b--StyledTimeDisplayText e1gw1eda0"" letter-spacing=""0"" style=""color: inherit; font-size: 32px;"">00:08 / 00:10</p><div class=""css-ekaxjt-7937d88b--DivProgressBar eer0cdn5""><div class=""css-h2belq-7937d88b--DivProgressBarScrub",html_dumps/7577580934644501815.html,0,True
https://www.tiktok.com/@collinskey/video/7576783795861474574?is_from_webapp=1&sender_device=pc,NOT AI,https://www.tiktok.com/@collinskey/video/7576783795861474574?is_from_webapp=1&sender_device=pc,https://www.tiktok.com/@collinskey/video/7576783795861474574,1.0,,ok,__UNIVERSAL_DATA_FOR_REHYDRATION__,7.576783795861474e+18,collinskey,1764107472.0,,91300000.0,14700000.0,51600.0,3100000.0,False,__DEFAULT_SCOPE__.webapp.video-detail.itemInfo.itemStruct.IsAigc,__DEFAULT_SCOPE__.webapp.biz-context.config.onDeviceMLConfig.commentsPreload.commentPreloadHighThreshold.preload_ml.output[0].labels;__DEFAULT_SCOPE__.webapp.biz-context.config.onDeviceMLConfig.commentsPreload.commentPreloadLowThreshold.preload_ml.output[0].labels;__DEFAULT_SCOPE__.webapp.biz-context.config.onDeviceMLConfig.playerPreload.playerPreloadStrategy.preload_ml.output[0].labels;__DEFAULT_SCOPE__.webapp.video-detail.itemInfo.itemStruct.IsAigc,"[{""path"": ""__DEFAULT_SCOPE__.webapp.video-detail.itemInfo.itemStruct.IsAigc"", ""value"": false}]","[{""path"": ""__DEFAULT_SCOPE__.webapp.biz-context.config.onDeviceMLConfig.commentsPreload.commentPreloadHighThreshold.preload_ml.output[0].labels"", ""value"": [""true"", ""false""]}, {""path"": ""__DEFAULT_SCOPE__.webapp.biz-context.config.onDeviceMLConfig.commentsPreload.commentPreloadLowThreshold.preload_ml.output[0].labels"", ""value"": [""true"", ""false""]}, {""path"": ""__DEFAULT_SCOPE__.webapp.biz-context.config.onDeviceMLConfig.playerPreload.playerPreloadStrategy.preload_ml.output[0].labels"", ""value"": [""true"", ""false""]}, {""path"": ""__DEFAULT_SCOPE__.webapp.video-detail.itemInfo.itemStruct.IsAigc"", ""value"": false}]","[{""path"": ""__DEFAULT_SCOPE__.webapp.i18n-translation.Webapp.seo_downloader_AboutDownloadingTikTokVideos"", ""value"": ""About downloading TikTok videos without watermark""}, {""path"": ""__DEFAULT_SCOPE__.webapp.i18n-translation.Webapp.seo_downloader_legal1"", ""value"": ""To protect creators' rights, TikTok currently does not support the download of videos without watermarks.""}, {""path"": ""__DEFAULT_SCOPE__.webapp.i18n-translation.Webapp.seo_downloader_metaDesc"", ""value"": ""Download TikTok videos effortlessly. Use TikTok Downloader and download TikTok videos without watermarks, as well as save them in MP3 and MP4 formats.""}, {""path"": ""__DEFAULT_SCOPE__.webapp.i18n-translation.Webapp.seo_downloader_mainMetaKeywords"", ""value"": ""Download Video TikTok, TikTok video Download, TikTok MP3, TikTok MP4, TikTok watermark, Save TikTok videos, Save TikTok""}, {""path"": ""__DEFAULT_SCOPE__.webapp.i18n-translation.Webapp.ad_report_reason_L1Misinfo_L2aigc_v2_0"", ""value"": ""This ad may contain AI-generated or edited content that is misused, unauthorized, or mislabeled. This can include:""}, {""path"": ""__DEFAULT_SCOPE__.webapp.i18n-translation.Webapp.ad_report_reason_L1Misinfo_L2aigc_v2_1"", ""value"": ""AI-generated content that isn't labeled or disclosed. The ad uses AI to create content, but doesn't say so.""}, {""path"": ""__DEFAULT_SCOPE__.webapp.i18n-translation.Webapp.seo_popular_disclaimer"", ""value"": ""This is an AI-generated summary of the content, and is not intended to provide factual context. If you think it may contain an error, please report at:""}, {""path"": ""__DEFAULT_SCOPE__.webapp.i18n-translation.Webapp.vid_mod_analytics_penalty_reason_unoriginal_desc"", ""value"": ""To keep TikTok positive and enjoyable for our users, content that is unoriginal or low quality is ineligible for recommendation. Unoriginal content includes videos that are just imported or uploaded from other sources (like other platforms, TV shows, movies, or webcasts) without any new, creative edits. We can tell if a video is unoriginal if it has a watermark or a superimposed logo on it. Low quality content includes very short videos, static images, and videos made only of GIFs. Content that includes QR codes is usually ineligible for the For You feed because it can lead users to harmful websites or apps, even though we make exceptions in circumstances where the risk is low (for example, for e-commerce).""}, {""path"": ""__DEFAULT_SCOPE__.webapp.i18n-translation.Webapp.vid_mod_analytics_nr_vid_penalty_reason_unoriginal_desc"", ""value"": ""To maintain the positive experience our users expect from the TikTok platform, unoriginal and low-quality content is ineligible for recommendation. Unoriginal content is content that is just imported or copied from other sources without any new, creative edits. A video may be unoriginal if it has a watermark or logo on it. Low quality content includes very short videos, static images, and videos made only of GIFs.""}, {""path"": ""__DEFAULT_SCOPE__.webapp.i18n-translation.Webapp.syntheticMedia_feed_bottomBanner_AIGCLabel"", ""value"": ""Creator labeled as AI-generated""}, {""path"": ""__DEFAULT_SCOPE__.webapp.i18n-translation.Webapp.aigcInfoPanel_feed_label"", ""value"": ""Contains AI-generated media""}]",True,ai-generated,"or on behalf of someone else."",""dsa_illegal_appeal_signature"":""Signature"",""dsa_illegal_sign_legal_name"":""Sign your legal name here."",""dsa_illegal_confirm_accuracy"":""I confirm my belief that the content of this report is true, accurate and complete."",""ad_report_detail_placeholder_75_uk"":""Please provide details about your experience with this ad to help us take necessary actions. Content that is harmful to children under the UK OSA includes pornography and sexual activities, suicide and self-injury, disordered eating, abuse and hate, violence, bullying, dangerous stunts and challenges, harmful substances, unhealthy body image and depressive content. Please identify a category if you are able."",""ad_report_detail_placeholder_75_eea_row"":""Please provide details about your experience with this ad to help us take necessary actions."",""ad_report_reason_L1Misinfo_L2aigc_v2_0"":""This ad may contain AI-generated or edited content that is misused, unauthorized, or mislabeled. This can include:"",""ad_report_reason_L1Misinfo_L2aigc_v2_1"":""AI-generated content that isn't labeled or disclosed. The ad uses AI to create content, but doesn't say so."",""ad_report_reason_L1Misinfo_L2aigc_v2_2"":""Using a real person's likeness, voice, or identity without their permission. The ad shows or sounds like a real person, but that person didn't agree to it (for example, making it seem like they support a political idea or product when they don't)."",""Web_report_description"":""Report description (Optional):"",""report_details_toast"":""Provide details about your experience with this ad to help us take necessary action."",""attachment_upload_limit"":""Every single file must be less than 20MB"",""report_img_toast"":""Upload images of order details and items received."",""dsa_illegal_select_country_optional"":""Legal jurisdiction"",""get_t",html_dumps/7576783795861474574.html,0,True
https://www.tiktok.com/@kamilashh23/video/7577571983873936653?is_from_webapp=1&sender_device=pc,NOT AI,https://www.tiktok.com/@kamilashh23/video/7577571983873936653?is_from_webapp=1&sender_device=pc,https://www.tiktok.com/@kamilashh23/video/7577571983873936653,1.0,,ok,__UNIVERSAL_DATA_FOR_REHYDRATION__,7.577571983873936e+18,kamilashh23,1764290985.0,i didn’t know dcc were allowed to wear ponytails. life changed #dcc #dallascowboyscheerleaders #cowboys #dallascowboys #dfw ,41000000.0,1300000.0,3605.0,3498.0,False,__DEFAULT_SCOPE__.webapp.video-detail.itemInfo.itemStruct.IsAigc,__DEFAULT_SCOPE__.webapp.biz-context.config.onDeviceMLConfig.commentsPreload.commentPreloadHighThreshold.preload_ml.output[0].labels;__DEFAULT_SCOPE__.webapp.biz-context.config.onDeviceMLConfig.commentsPreload.commentPreloadLowThreshold.preload_ml.output[0].labels;__DEFAULT_SCOPE__.webapp.biz-context.config.onDeviceMLConfig.playerPreload.playerPreloadStrategy.preload_ml.output[0].labels;__DEFAULT_SCOPE__.webapp.video-detail.itemInfo.itemStruct.IsAigc,"[{""path"": ""__DEFAULT_SCOPE__.webapp.video-detail.itemInfo.itemStruct.IsAigc"", ""value"": false}]","[{""path"": ""__DEFAULT_SCOPE__.webapp.biz-context.config.onDeviceMLConfig.commentsPreload.commentPreloadHighThreshold.preload_ml.output[0].labels"", ""value"": [""true"", ""false""]}, {""path"": ""__DEFAULT_SCOPE__.webapp.biz-context.config.onDeviceMLConfig.commentsPreload.commentPreloadLowThreshold.preload_ml.output[0].labels"", ""value"": [""true"", ""false""]}, {""path"": ""__DEFAULT_SCOPE__.webapp.biz-context.config.onDeviceMLConfig.playerPreload.playerPreloadStrategy.preload_ml.output[0].labels"", ""value"": [""true"", ""false""]}, {""path"": ""__DEFAULT_SCOPE__.webapp.video-detail.itemInfo.itemStruct.IsAigc"", ""value"": false}]","[{""path"": ""__DEFAULT_SCOPE__.webapp.i18n-translation.Webapp.seo_downloader_AboutDownloadingTikTokVideos"", ""value"": ""About downloading TikTok videos without watermark""}, {""path"": ""__DEFAULT_SCOPE__.webapp.i18n-translation.Webapp.seo_downloader_legal1"", ""value"": ""To protect creators' rights, TikTok currently does not support the download of videos without watermarks.""}, {""path"": ""__DEFAULT_SCOPE__.webapp.i18n-translation.Webapp.seo_downloader_metaDesc"", ""value"": ""Download TikTok videos effortlessly. Use TikTok Downloader and download TikTok videos without watermarks, as well as save them in MP3 and MP4 formats.""}, {""path"": ""__DEFAULT_SCOPE__.webapp.i18n-translation.Webapp.seo_downloader_mainMetaKeywords"", ""value"": ""Download Video TikTok, TikTok video Download, TikTok MP3, TikTok MP4, TikTok watermark, Save TikTok videos, Save TikTok""}, {""path"": ""__DEFAULT_SCOPE__.webapp.i18n-translation.Webapp.ad_report_reason_L1Misinfo_L2aigc_v2_0"", ""value"": ""This ad may contain AI-generated or edited content that is misused, unauthorized, or mislabeled. This can include:""}, {""path"": ""__DEFAULT_SCOPE__.webapp.i18n-translation.Webapp.ad_report_reason_L1Misinfo_L2aigc_v2_1"", ""value"": ""AI-generated content that isn't labeled or disclosed. The ad uses AI to create content, but doesn't say so.""}, {""path"": ""__DEFAULT_SCOPE__.webapp.i18n-translation.Webapp.seo_popular_disclaimer"", ""value"": ""This is an AI-generated summary of the content, and is not intended to provide factual context. If you think it may contain an error, please report at:""}, {""path"": ""__DEFAULT_SCOPE__.webapp.i18n-translation.Webapp.vid_mod_analytics_penalty_reason_unoriginal_desc"", ""value"": ""To keep TikTok positive and enjoyable for our users, content that is unoriginal or low quality is ineligible for recommendation. Unoriginal content includes videos that are just imported or uploaded from other sources (like other platforms, TV shows, movies, or webcasts) without any new, creative edits. We can tell if a video is unoriginal if it has a watermark or a superimposed logo on it. Low quality content includes very short videos, static images, and videos made only of GIFs. Content that includes QR codes is usually ineligible for the For You feed because it can lead users to harmful websites or apps, even though we make exceptions in circumstances where the risk is low (for example, for e-commerce).""}, {""path"": ""__DEFAULT_SCOPE__.webapp.i18n-translation.Webapp.vid_mod_analytics_nr_vid_penalty_reason_unoriginal_desc"", ""value"": ""To maintain the positive experience our users expect from the TikTok platform, unoriginal and low-quality content is ineligible for recommendation. Unoriginal content is content that is just imported or copied from other sources without any new, creative edits. A video may be unoriginal if it has a watermark or logo on it. Low quality content includes very short videos, static images, and videos made only of GIFs.""}, {""path"": ""__DEFAULT_SCOPE__.webapp.i18n-translation.Webapp.syntheticMedia_feed_bottomBanner_AIGCLabel"", ""value"": ""Creator labeled as AI-generated""}, {""path"": ""__DEFAULT_SCOPE__.webapp.i18n-translation.Webapp.aigcInfoPanel_feed_label"", ""value"": ""Contains AI-generated media""}]",True,ai-generated,"or on behalf of someone else."",""dsa_illegal_appeal_signature"":""Signature"",""dsa_illegal_sign_legal_name"":""Sign your legal name here."",""dsa_illegal_confirm_accuracy"":""I confirm my belief that the content of this report is true, accurate and complete."",""ad_report_detail_placeholder_75_uk"":""Please provide details about your experience with this ad to help us take necessary actions. Content that is harmful to children under the UK OSA includes pornography and sexual activities, suicide and self-injury, disordered eating, abuse and hate, violence, bullying, dangerous stunts and challenges, harmful substances, unhealthy body image and depressive content. Please identify a category if you are able."",""ad_report_detail_placeholder_75_eea_row"":""Please provide details about your experience with this ad to help us take necessary actions."",""ad_report_reason_L1Misinfo_L2aigc_v2_0"":""This ad may contain AI-generated or edited content that is misused, unauthorized, or mislabeled. This can include:"",""ad_report_reason_L1Misinfo_L2aigc_v2_1"":""AI-generated content that isn't labeled or disclosed. The ad uses AI to create content, but doesn't say so."",""ad_report_reason_L1Misinfo_L2aigc_v2_2"":""Using a real person's likeness, voice, or identity without their permission. The ad shows or sounds like a real person, but that person didn't agree to it (for example, making it seem like they support a political idea or product when they don't)."",""Web_report_description"":""Report description (Optional):"",""report_details_toast"":""Provide details about your experience with this ad to help us take necessary action."",""attachment_upload_limit"":""Every single file must be less than 20MB"",""report_img_toast"":""Upload images of order details and items received."",""dsa_illegal_select_country_optional"":""Legal jurisdiction"",""get_t",html_dumps/7577571983873936653.html,0,True
